{
  "schema_version": "slot-alignment.parallel-execution-policy.v1",
  "policy_id": "deterministic-single-candidate-sample-sharding-v1",
  "version": "1.0.0",
  "source_path": "assets/policies/parallel_execution_policy.v1.json",
  "worker_count_mode": "auto",
  "cpu_count_source": "process_available_logical_cpu",
  "cpu_fraction": 0.7,
  "rounding": "floor",
  "minimum_workers": 1,
  "backend": "process",
  "parallelism_scope": "single_candidate_sample_shards",
  "candidate_parallelism_enabled": false,
  "nested_process_pools_enabled": false,
  "total_sample_budget_unchanged": true,
  "shard_plan_sealed_before_execution": true,
  "shard_assignment": "contiguous_global_entry_ranges",
  "rng_partition_key": "sealed_seed_and_global_entry_index",
  "worker_id_affects_rng": false,
  "merge_order": "shard_index_ascending",
  "merge_level": "raw_accumulators",
  "derived_metrics_after_merge": true,
  "failed_worker_action": "rerun_original_shard_only",
  "single_worker_equivalence_required": true,
  "same_shard_plan_for_equivalence_check": true,
  "formal_independence_source": "sealed_seed_and_sample_plan",
  "worker_count_affects_formal_independence": false
}
